{
  "availability_status": "DISABLED",
  "change_type": "DELETED",
  "changed_at": "2026-09-03T08:41:00Z",
  "display_name": "2026版信用卡产品说明.pdf",
  "document_id": "319f011f196e49a28583b904b90e0b1e",
  "event_type": "file_fact_changed",
  "file_id": "5ca94af456ee42e28729cd0555a28d01",
  "file_version": 10,
  "lifecycle_status": "DELETED",
  "operation_id": "77777777777777777777777777777777",
  "original_name": "信用卡产品说明.pdf",
  "schema_version": "1.0"
}
